{
  "schema_version": "1.0",
  "feature_id": "article-lifecycle",
  "revision": 1,
  "designer_revisions": [
    {
      "action": "add",
      "target_type": "coverage_item",
      "target_id": null,
      "payload": {
        "id": "CI-12",
        "requirement_ids": ["R9", "R15"],
        "technique": "EP",
        "description": "Unauthorized update/delete negative partitions"
      },
      "reason": "Add explicit negative auth checks for update/delete lifecycle actions."
    },
    {
      "action": "add",
      "target_type": "test_case",
      "target_id": null,
      "payload": {
        "id": "TC-017",
        "title": "Unauthenticated update rejected",
        "requirement_ids": ["R9"],
        "priority": "High",
        "steps": ["PUT /articles/{slug} without token"],
        "expected_result": "Update request is rejected as unauthorized"
      },
      "reason": "Strengthen negative-path evidence for update auth behavior."
    },
    {
      "action": "add",
      "target_type": "test_case",
      "target_id": null,
      "payload": {
        "id": "TC-018",
        "title": "Unauthenticated delete rejected",
        "requirement_ids": ["R15"],
        "priority": "High",
        "steps": ["DELETE /articles/{slug} without token"],
        "expected_result": "Delete request is rejected as unauthorized"
      },
      "reason": "Strengthen negative-path evidence for delete auth behavior."
    }
  ]
}
