{
  "schema_version": "1.0",
  "feature_id": "article-lifecycle",
  "revision": 2,
  "designer_revisions": [
    {
      "action": "modify",
      "target_type": "test_case",
      "target_id": "TC-016",
      "payload": {
        "expected_result": "Retrieval fails after deletion; 404 not-found style response is preferred and any equivalent not-found contract is acceptable."
      },
      "reason": "Make expected result verifiable while tolerating implementation-specific error envelope."
    },
    {
      "action": "modify",
      "target_type": "traceability",
      "target_id": "R15-CI-10",
      "payload": {
        "test_case_ids": ["TC-014", "TC-018"]
      },
      "reason": "Trace both positive and negative auth partitions for delete behavior."
    }
  ]
}
